{
  "$schema": "../../schema/request.schema.json",
  "type": "http",
  "name": "Create post",
  "description": "Create a new post with title and body.",
  "method": "POST",
  "url": "{{base_url}}/posts",
  "headers": [
    { "key": "Content-Type", "value": "application/json" },
    { "key": "Authorization", "value": "Bearer {{auth_token}}" }
  ],
  "body": "{\n  \"title\": \"Hello\",\n  \"body\": \"World\"\n}"
}
